{"checks":[{"checked_artifact_paths":["promax-artifact-manifest.json","promax-claim-path-graph.json","promax-concept-disposition-ledger.json","promax-continuation-ledger.json","promax-local-world-model.locked.json","promax-output-plan.locked.json","promax-position.locked.json","promax-recommendation.locked.json","promax-red-team-report.json","promax-retrieval-ledger.json","promax-run-contract.json","promax-source-snapshot.json"],"failure_codes":[],"status":"pass","validator_id":"schema"},{"checked_artifact_paths":["promax-source-snapshot.json","promax-read-events.jsonl"],"failure_codes":[],"status":"pass","validator_id":"source-integrity"},{"checked_artifact_paths":["skills/crossframe-promax/SKILL.md"],"failure_codes":[],"status":"pass","validator_id":"version-isolation"},{"checked_artifact_paths":["promax-concept-disposition-ledger.json"],"failure_codes":[],"status":"pass","validator_id":"concept-closure"},{"checked_artifact_paths":["promax-claim-path-graph.json"],"failure_codes":[],"status":"pass","validator_id":"claim-path"},{"checked_artifact_paths":["promax-retrieval-ledger.json"],"failure_codes":[],"status":"pass","validator_id":"retrieval"},{"checked_artifact_paths":["promax-red-team-report.json","promax-position.locked.json","promax-recommendation.locked.json"],"failure_codes":[],"status":"pass","validator_id":"position"},{"checked_artifact_paths":["promax-output-plan.locked.json","promax-dossier.md","promax-concept-atlas.md","promax-case-and-countercase.md","promax-essay.md"],"failure_codes":[],"status":"pass","validator_id":"output"},{"checked_artifact_paths":["promax-artifact-manifest.json"],"failure_codes":[],"status":"pass","validator_id":"manifest"},{"checked_artifact_paths":["promax-phase-events.jsonl"],"failure_codes":[],"status":"pass","validator_id":"state-machine"},{"checked_artifact_paths":["promax-continuation-ledger.json","promax-continuation-index.md"],"failure_codes":[],"status":"pass","validator_id":"continuation"}],"completion_status":"promax-complete","current_artifact_hashes":[{"media_type":"text/markdown","path":"promax-case-and-countercase.md","sha256":"210b85fb0f48106f8dff168bdce962390eba27f0cf96142c0a312cd358e197ed"},{"media_type":"application/json","path":"promax-claim-path-graph.json","sha256":"a49e5214735f7b49c467a06f744ba356fcd61da2f78429b720c6ede0aa96ff77"},{"media_type":"text/markdown","path":"promax-concept-atlas.md","sha256":"ee29e8271ea89135d89b96c2b79158c73bc1294cfe0d110347d6da6145d4db69"},{"media_type":"application/json","path":"promax-concept-disposition-ledger.json","sha256":"fcee2749f9964836fd3e7209443642d70cc9dc4c0c9fbd4b89515415b9c5a87d"},{"media_type":"text/markdown","path":"promax-continuation-index.md","sha256":"2a6d4578919dcb5e41b8b29ebb5108d8eac0f821bd6c5c348073e10c6fc04c4e"},{"media_type":"text/markdown","path":"promax-dossier.md","sha256":"b038bb0df9cbf3897cdcc583946d9c92edbe1fa3c090b59a51e6546bd98e8450"},{"media_type":"text/markdown","path":"promax-essay.md","sha256":"b3ae41721d1c93601888c09c37e10afca6b4b16a0ed729015aca1096209ec0bf"},{"media_type":"application/json","path":"promax-local-world-model.locked.json","sha256":"2a389d9af3ee4b491ad5899d6381f4396c785bd1b0a52f1ba8bf95e72fba3d36"},{"media_type":"application/json","path":"promax-output-plan.locked.json","sha256":"7aab850a93e209716724cebef4614c6c1a08ca39ffc96bc75eeae935f64810e3"},{"media_type":"application/json","path":"promax-position.locked.json","sha256":"d452f3213e1d17e64ec3fc5fd9c847e439324dfd48cf5ce2c82830db3f81dcb2"},{"media_type":"application/x-ndjson","path":"promax-read-events.jsonl","sha256":"75cbe0b1ade6e815541b933dec65972fe6bce771841a2aef01779dc40d16bfb1"},{"media_type":"application/json","path":"promax-recommendation.locked.json","sha256":"7fd8224687e3976d32d384aa38ee2a0bb5692ea406892fdcdd0c9ba13fd066f6"},{"media_type":"application/json","path":"promax-red-team-report.json","sha256":"011c767b5dcb0dac6a0bb1243dc03eb3aa3fe9592ae154d9855230b11a3674d9"},{"media_type":"application/json","path":"promax-retrieval-ledger.json","sha256":"03306bcf544522a51000307b246f767e5bc92c132abee6cae8e3168967186e0f"},{"media_type":"application/json","path":"promax-source-snapshot.json","sha256":"5f21fb0e9f9bad4f6ccd466d49b1923450bb8ef61c257b071f4541b827064454"},{"media_type":"text/markdown","path":"promax-worldview-capsule.locked.md","sha256":"a85ac17dfca032a3f0afc1766c2ad71c2efeb96482efbb6b9a6b573660cbe06b"}],"manifest_sha256":"89d1fb677212d0555914578c7d1cd626f257e0914ca3961440a941e34dc8769e","overall_status":"pass","phase_chain_head_sha256":"4cd979a97abddedcea7d64928b60646065b2d0fe5e729898bdad67698720016b","report_sha256":"1d75eeb85d471381850ddd4cd0d384e647601bfc1891763fec29916c1a02b5aa","request_sha256":"b9f79081b8f9c5e5b89d7230094a3e51efa2a3d19060d03fd5b4c72e7afdc769","run_id":"promax-green-v3-gpt-5-6-sol-a1-f2bde4ebcefa435fbf4be12cf278730b","run_nonce":"74e5c25309009d718c6d8ff21a09964258b6f8adf8350192df190c0cf3c84962","schema_id":"crossframe.promax.v8.validator-report","schema_version":1,"source_snapshot_sha256":"3186805a3e46e1b16948a4e51d08e7693a8e0dd04aa6b4604e796266d649936c","validated_at":"2026-07-23T08:04:22.962565Z","validation_attempt":2,"validator_set_sha256":"58d03816fdbc3620bd19b6070ac34b90a6e9a04a09e14369da5d2f8e26646f14"}
