{"checks":[{"checked_artifact_paths":["promax-artifact-manifest.json","promax-claim-path-graph.json","promax-concept-disposition-ledger.json","promax-continuation-ledger.json","promax-local-world-model.locked.json","promax-output-plan.locked.json","promax-position.locked.json","promax-recommendation.locked.json","promax-red-team-report.json","promax-retrieval-ledger.json","promax-run-contract.json","promax-source-snapshot.json"],"failure_codes":[],"status":"pass","validator_id":"schema"},{"checked_artifact_paths":["promax-source-snapshot.json","promax-read-events.jsonl"],"failure_codes":[],"status":"pass","validator_id":"source-integrity"},{"checked_artifact_paths":["skills/crossframe-promax/SKILL.md"],"failure_codes":[],"status":"pass","validator_id":"version-isolation"},{"checked_artifact_paths":["promax-concept-disposition-ledger.json"],"failure_codes":[],"status":"pass","validator_id":"concept-closure"},{"checked_artifact_paths":["promax-claim-path-graph.json"],"failure_codes":[],"status":"pass","validator_id":"claim-path"},{"checked_artifact_paths":["promax-retrieval-ledger.json"],"failure_codes":[],"status":"pass","validator_id":"retrieval"},{"checked_artifact_paths":["promax-red-team-report.json","promax-position.locked.json","promax-recommendation.locked.json"],"failure_codes":[],"status":"pass","validator_id":"position"},{"checked_artifact_paths":["promax-output-plan.locked.json","promax-dossier.md","promax-concept-atlas.md","promax-case-and-countercase.md","promax-essay.md"],"failure_codes":[],"status":"pass","validator_id":"output"},{"checked_artifact_paths":["promax-artifact-manifest.json"],"failure_codes":[],"status":"pass","validator_id":"manifest"},{"checked_artifact_paths":["promax-phase-events.jsonl"],"failure_codes":[],"status":"pass","validator_id":"state-machine"},{"checked_artifact_paths":["promax-continuation-ledger.json","promax-continuation-index.md"],"failure_codes":[],"status":"pass","validator_id":"continuation"}],"completion_status":"promax-complete","current_artifact_hashes":[{"media_type":"text/markdown","path":"promax-case-and-countercase.md","sha256":"3ee20b5b766ff363218423e4982b691fe5b911e783941953891dd300c8f352f6"},{"media_type":"application/json","path":"promax-claim-path-graph.json","sha256":"7effe9463ef379954333508156d8e9f019627b61f0c0fec7b777118ec1142b87"},{"media_type":"text/markdown","path":"promax-concept-atlas.md","sha256":"4590ca470f7c8a3b1455e25c71566d64c7a53ffb9a6bfb6490e40df498a0fbbe"},{"media_type":"application/json","path":"promax-concept-disposition-ledger.json","sha256":"da7d28f8e11858743239de923dacf9712d545e9823524c1c342d4ec34b074c4b"},{"media_type":"text/markdown","path":"promax-continuation-index.md","sha256":"af44d250b65b19414ff718c6b48f6c3497bc2309e6c26c28eb0cad17e03c81b9"},{"media_type":"text/markdown","path":"promax-dossier.md","sha256":"1ee3d21201d020fef2669f0a88f4fb17fb4244af721163fc3fa5b456b39fc1e9"},{"media_type":"text/markdown","path":"promax-essay.md","sha256":"7feabaad027bd7fe5c1a7dacb0acfb869b79de53b11af9e2f8c1049ab872c5d2"},{"media_type":"application/json","path":"promax-local-world-model.locked.json","sha256":"d1d7fec4d96a4d5244ea616bafcc8f5cada1956f81507ca6a2af20844a62a0be"},{"media_type":"application/json","path":"promax-output-plan.locked.json","sha256":"4024fa67d812cf8e7c95e3e71fba7acb8eb5b93529e14e6b00e87002c4e0670b"},{"media_type":"application/json","path":"promax-position.locked.json","sha256":"a6e03c39293b603bc53406405bc094f239b391dcc636dea0e49854f5e09efd38"},{"media_type":"application/x-ndjson","path":"promax-read-events.jsonl","sha256":"35fd443221d7293f5fefa7a226919749c1f4eabd166f4db52f0a3cf64526928c"},{"media_type":"application/json","path":"promax-recommendation.locked.json","sha256":"e61b14e15ba3355d5b0d21066522278e479c4b759f4475984596c192c3f84499"},{"media_type":"application/json","path":"promax-red-team-report.json","sha256":"9d3c1ef8dad39ad95e3c2eb766d148f55cbdc37e7c7fc5a901997b31495bbeeb"},{"media_type":"application/json","path":"promax-retrieval-ledger.json","sha256":"2fb953f6d3272bbcbe9195d1cc5174fb812c8825165ebd5c615ef1860da2a2b9"},{"media_type":"application/json","path":"promax-source-snapshot.json","sha256":"2cd897536fc625a0503a90596a66637c21e3dd9d6b8d8bb94e831f9e6c78c8c5"},{"media_type":"text/markdown","path":"promax-worldview-capsule.locked.md","sha256":"cd89758cda3ec5d64879cc62a302db0cf6d0a6b8dee721d25ff52eb612506172"}],"manifest_sha256":"a7940ff18e27c20af5709f13efe93fa914b2e350aabab742d592958784254d26","overall_status":"pass","phase_chain_head_sha256":"65a0b8fe0f91d83ace1c84b3914d61a571349492828af50a58b0003c67ba1282","report_sha256":"a9472fd5638ace6e5f25c66013e857e56de2661dd2d02cf83229152332bb8568","request_sha256":"ad8a63541e42943ecf7ae1ca329a138a01c9355d7ffe353e9565c0f711f92e99","run_id":"promax-green-v4-gpt-5-6-sol-a2-9742973771c64e89813a768c7894faa8","run_nonce":"b93edb6ee221f2443b6e8819805f3e9e108f4e86147647c4911ca077ef78cb37","schema_id":"crossframe.promax.v8.validator-report","schema_version":1,"source_snapshot_sha256":"3186805a3e46e1b16948a4e51d08e7693a8e0dd04aa6b4604e796266d649936c","validated_at":"2026-07-23T09:50:00Z","validation_attempt":1,"validator_set_sha256":"58d03816fdbc3620bd19b6070ac34b90a6e9a04a09e14369da5d2f8e26646f14"}
